ID,Date,Time,Location,Operator,Flight,Route,Type,Registration,CN_IN,Aboard,Fatalities,Ground,Survivors,SurvivalRate,Summary,ClustID
366,2/4/1997,19:00,NORTHERN ISRAEL,MILITARY - ISRAEL AIR FORCE /MILITARY -  ISRAEL AIR FORCE,Not Available,NOT AVAILABLE,SIKORSKY CH53D / SIKORSKY CH53D,357 / 903,Not Available,73,73,0,0,0,The two military helicopters crashed into each other while taking off in darkness killing all aboard.,High Fatality
367,3/13/1997,18:06,"NEAR MASHHAD, IRAN",MILITARY - IRANIAN AIR FORCE,Not Available,DEZFUL - MASHHAD,LOCKHEED C-130HF,Not Available,Not Available,88,88,0,0,0,The plane was carrying military personnel and their families and crashed 24 miles NE of Mashhad in the Binalud Heights. The pilot reported engine failure prior the crash.,High Fatality
368,8/6/1997,1:42,"AGANA, GUAM",KOREAN AIRLINES,801,SEOUL - GUAM,BOEING B-747-300,HL-7468,22487/605,254,229,0,25,0.098,"The aircraft crashed into Nimitz Hill, 3 miles short of Runway 06R, while making a non-precision approach in heavy rain to A.B. Won Guam International Airport. The runway glide slope system was inoperative. In addition, the Minimum Safe Altitude Warning system (MSAW) was also not working due to a software problem. The captainâ€™s failure to adequately brief and execute the non-precision approach and the first officer's and flight engineer's failure to effectively monitor and cross-check the captainâ€™s execution of the approach. Contributing to these failures were the captain's fatigue and Korean Air's  inadequate flight crew training. Contributing to the accident was the Federal Aviation Administration's (FAA) intentional inhibition of the MSAW at Guam and the agency's failure to adequately manage the system.",High Fatality
369,9/26/1997,13:34,"BUAH NABAR, INDONESIA",GARUDA INDONESIA AIRLINES,152,JAKARTA - MEDAN,AIRBUS A300-B4-200,PK-GAI,214,234,234,0,0,0,The aircraft crashed into mountainous terrain 15 minutes before it was due to land at Medan on a flight from Jakarta. The aircraft crashed 20 miles from the airport. ATC error in directing the plane in the wrong direction into mountainous terrain that was obscured by smoke and haze due to forest fires in the area.,High Fatality
370,10/10/1997,22:23,"NUEVO BERLIN, URUGUAY",AUSTRAL LINEAS AERAS (ARGENTINA),2553,POSADAS - BUENOS AIRES,MCDONNELL DOUGLAS DC-9-32,LV-WEG,47446/561,74,74,0,0,0,"The aircraft crashed  near Nuevo Berlin, a town on the banks of the Uruguay River, after changing its route to avoid heavy rain and hail. A crater 25 feet deep crater was created where the plane crashed into the earth.  Pitot heater failure.",High Fatality
371,12/16/1997,18:35,"SHARJAH, UNITED ARAB EMIRATES",TAJIKISTAN AIRLINES,3183,DUSHANBE - SHARJAH,TUPOLEV TU-154,EY-85281,78A-281,86,85,0,1,0.012,The aircraft crashed and burned while making an attempt to land. A number of errors by the crew resulted in the acccident. Not maintaining the height indicated during the last contact with the ATC. Not following instructions from the ATC. Crew fatigue and turbulence in the area contributed to the accident.,High Fatality
372,12/17/1997,21:13,"FOTINA, GREECE",AEROSWEET AIRLINES (LVOV),241,ODESSA - THESSALONIKI,YAKOVLEV YAK-42,UR-42334,4520422606,70,70,0,0,0,"The aircraft crashed into Mt. Olympus while approaching Salonica, during a second attempt to land. The plane was holding at 3,300 feet due to heavy traffic. Tower tapes indicate that after the missed approach, the crew reported they were heading north when they actually were heading west. An investigation revealed the crew had poor training, flew too low, didn't know how to use the radar equipment and failed to declare an emergency after they missed the landing strip. A second crash occurred when a C-130 transport plane on its way to pick up troops to assist in the search, crashed into Pastra Mountain.",High Fatality
373,12/19/1997,16:13,"NEAR PALEMBANG, INDONESIA",SILKAIR,185,JAKARTA - HATTA - SINGAPORE,BOEING B-737-300,9V-TRF,28556/2851,104,104,0,0,0,"The plane disappeared off radar screens and shortly after, crashed into the Musi River. The plane, almost brand-new, cruising in good weather and with an experienced crew, suddenly left normal flight from 35,000 feet and crashed at a high rate of speed into the Sumatran jungle. The right wing and parts of the rudder separated from the aircraft before it crashed. The Indonesian National Transportation Committee found that there was insufficient evidence to find a cause for the accident. The U.S. National Transportation Safety Board strongly disagreed and stated the jet's cockpit voice recorder was intentionally disconnected and its flight controls placed in a nose-down position most likely by the captain. While the U.S. NTSB stopped short of using the term suicide, its dissenting report made it clear it believed the crash was the result of actions by the captain. In July 2004 a California jury found the manufacturer of the PCU valve that controls rudder responsible for the accident after the valve was located and showed defects which may have led to a rudder hardover.",High Fatality
374,12/28/1997,23:10,OVER THE PACIFIOCEAN,UNITED AIR LINES,826,TOKYO - HONOLULU,BOEING B-747-122,N4723U,19882/175,393,1,0,392,0.997,"Two hours into the flight, at FL 310, the plane received reports of severe clear air turbulence in the area and the seat belt sign was turned on. Moments later, the aircraft suddenly dropped around one hundred feet seriously injuring many passengers and causing damage to the aircraft. The plane landed safely back at Tokyo, but  one passenger died of her injuries.",Low Fatality
375,2/2/1998,11:00,"PAGALUNGAN, PHILIPPINES",CEBU PACIFIAIR,387,TACLOBAN - CAGAYAN DE ORO,MCDONNELL DOUGLAS DC-9-32,RP-C1507,47069/175,104,104,0,0,0,"Flight 387 originated in Manila on a flight to Tacloban and Cagayan de Oro. The aircraft crashed while on approach to Cagay de Oro into a remote mountainous area.  Wreckage was found near the town of Pagalungan, NE of Cagay de Oro. The last radio message from the pilot was 'leveling off at 5,000 feet sir.'  The cockpit voice recorder revealed that the GPWS warned of terrain a dozen times just before impact. The crew apparently got lost in a cloud, never realizing they were headed into a mountain. Pilot error, inadequate training standards and deficient equipment.",High Fatality
376,2/16/1998,20:09,"TAIPEI, TAIWAN",CHINA AIRLINES (TAIWAN),676,DENPASAR - TAIPEI,AIRBUS A300-622R,B-1814,578,196,196,7,0,0,"The aircraft was attempting to land at Taipei's international airport in rain and fog when the crew requested a go-around. The plane crashed into a residential neighborhood, ripping the roofs off several structures, skidding into a rice paddy and bursting in flames. DFDR data showed complete autopilot disengagement just after landing clearance. This was  followed by an attempted manually flown go-around with falling airspeed and a pitch-up of 40 degrees followed by a gain of 1,000 feet in altitude, total stall and a dive resulting in impact with the ground.",High Fatality
377,3/22/1998,19:42,"BACOLOD, PHILIPPINES",PHILIPPINE AIR LINES,137,MANILA - BACOLOD,AIRBUS A.320-214,RP-C3222,708,127,0,3,127,1,"The aircraft overran the 6,888 ft. runway, went through a concrete perimeter fence, crossed a small river and hit a karaoke house before stopping near a market. The plane was (legally) released from Manila with the No. 1 reverser deactivated. The plane landed mid-runway and the crew incorrectly used the No. 2 reverser to try and stop the plane causing it to veer to the right. The No. 2 engine was then to set to forward thrust steering the plane back on the runway.  A go-around was attempted but it was too late and the aircraft overran the runway.",Low Fatality
378,5/5/1998,21:30,"ANDOAS, PERU",FUERZA AÃ‰REA DEL PERU,Not Available,IQUITOS - ANDOAS,BOEING B-737-282,FAP-351,23041/962,88,75,0,13,0.148,"The aircraft was chartered by the Los Angeles-based Occidental Petroleum Corporation. The plane crashed in light rain, while on final approach, in a swampy area, three miles short of Andoas. There were reports of a lightning flash preceding the accident.",High Fatality
379,8/29/1998,13:03,"QUITO, ECUADOR",CUBANA DE AVIACION,389,QUITO - GUAYAQUIL - HAVANA,TUPOLEV TU-154M,CU-T1264,720,91,70,10,21,0.231,"The aircraft crashed and burned during takeoff from Quito. The crew tried and failed twice to take off. On the third attempt, the plane struggled to gain altitude, rising a few feet, but settled back to earth plowing past the end of the runway and crashing into an auto body shop and coming to rest in a soccer field. The accident was caused by the late decision of the crew to abort the takeoff.",High Fatality
380,9/2/1998,21:30,"OFF PEGGY'S COVE, NOVA SCOTIA, CANADA",SWISSAIR,111,NEW YORK CITY - GENEVA,MCDONNELL DOUGLAS MD-11,HB-IWF,48448/465,229,229,0,0,0,"The aircraft was on a flight from JFK Airport, New York to Geneva, Switzerland when the crew reported smoke in the cockpit and requested an emergency landing at Halifax. The plane began dumping fuel and preparing for an emergency landing when it disappeared from radar and crashed into the AtlantiOcean southwest of Halifax. A fire in the entertainment system wiring started in a hidden area above the cockpit ceiling when arcing ignited the cover material made of thermal insulation blankets. This set off an in-flight fire that spread and increased in intensity until it led to the loss of the aircraft.. It was determined that  aircraft certification standards for material flammability at the time of the accident were inadequate. Dr. Jonathan Mann, researcher in the fight against AIDS killed in the crash.",High Fatality
381,12/11/1998,19:10,"NEAR SURAT THANI, THAILAND",THAI AIRWAYS,261,BANGKOK - SURAT THANI,AIRBUS A-310-204,HS-TIA,415,146,102,0,44,0.301,"The plane crashed 2 miles southwest of Surat Thani Airport. The accident occurred in poor visibility and heavy rain. After a third landing attempt, the plane could not gain altitude and crashed into a paddy field. First reports suggest the aircraft stalled and pancaked into the ground tail first. Spatial disorientation when the nose pitched up sharply during a nighttime approach in stormy weather.",High Fatality
382,6/1/1999,23:50,"LITTLE ROCK, ARKANSAS",AMERICAN AIRLINES,1420,DALLAS-FORT WORTH - LITTLE ROCK,MCDONNELL DOUGLAS MD-82,N215AA,49163/1111,145,11,0,134,0.924,"The plane was on a flight from Dallas/Fort Worth, Texas to Little Rock, Arkansas. While attempting to land at Little Rock Airport, the flight encountered heavy thunderstorms, rain and strong winds. The aircraft landed fast and hard, skidded off the end of the runway and struck a landing light tower, breaking into three parts and bursting into flames. Crew's decision to continue the approach despite severe thunderstorms in the area and crosswinds that  exceeded American Airlines' guidelines. The crew did not arm the automatispoiler system before landing or manually deploy the spoilers after touchdown. Fatigue, the crew had been awake for nearly 16 hours.",Low Fatality
383,7/23/1999,11:25,"TOKYO, JAPAN",ALL NIPPON AIRWAYS,61,"TOKYO, JAPAN - CHITOSE, JAPAN",BOEING B-747,Not Available,Not Available,517,1,0,516,0.998,"Two minutes after taking off from Haneda Airport, a man carrying a knife forced a flight attendant to take him in the cockpit of the plane.  A fan of computer flight-simulation games, he stated he just wanted to fly a real plane.  After forcing the co-pilot out of the cockpit he ordered the captain to fly to a U.S. Air Force base in western Tokyo. When he refused, he stabbed the captain and seized the controls. After a sudden drop in altitude, the co-pilot and an off duty crew member entered the cockpit and overpowered the hijacker.  A one point the plane plunged to within 984 feet of the ground. The plane ultimately  landed safely but the captain died of his injuries.",Low Fatality
384,8/24/1999,12:36,"HUALIAN, TAIWAN",UNI AIR,873,TAIPEI - HUALIAN,MCDONNELL DOUGLAS MD-90-30,B-17912,53536/2160,96,1,0,95,0.99,"A fire in the front portion of the cabin, in the overhead luggage compartment, caused thick black smoke to accumulate in the cabin.  Accidental ignition of gas taken aboard in 2 bleach and softner bottles, stored in a overhead locker.",Low Fatality
385,8/31/1999,20:55,"BUENOS AIRES, ARGENTINA","LAPA, LINEAS AEREAS PRIVADAS ARGENTINAS",3142,BUENOS AIRES - CORDOBA,BOEING B-737-204C,LV-WRZ,20389/251,103,64,10,39,0.379,"While attempting to take off from Jorge Newberry airport, the crew aborted takeoff, overran the runway, skidded across a service road and crashed into several cars and into a golf course, bursting into flames.  The crew had the wrong flap selection for takeoff.",High Fatality
386,10/31/1999,6:52,"OFF NANTUCKET ISLAND, MASSACHUSETTS",EGYPTAIR,990,NEW YORK CITY - CAIRO,BOEING B-767-366ER,SU-GAP,24542/282,217,217,0,0,0,"The plane took off from JFK at 1:19 a.m. bound for Cairo, Egypt. Thirty-three minutes later, after attaining an altitude of 33,000 feet, it was observed on radar in an extremely rapid descent. The aircraft was observed in a 66 degree dive at 483 knots. The descent continued to 16,700 feet after which the aircraft climbed to 24,000 ft.   After that, the plane began a second dive and broke up at around 10,000 ft. crashing into the AtlantiOcean, 60 miles southeast of Nantucket Island.  The aircraft was named Thutmosis III. The accident was caused by the relief first officer's flight control inputs which caused the airplane's departure from normal cruise flight and subsequent impact with the AtlantiOcean. The reason for the first officer's actions were not determined by the NTSB. One could conclude the actions were deliberate in an attempt to commit suicide.",High Fatality
387,12/10/1999,Not Available,"KUWAIT CITY, KUWAIT",MILITARY - U.S. AIR FORCE,Not Available,NOT AVAILABLE,LOCKHEED C-130H,63-7854,3924,94,3,0,91,0.968,"Crashed  2,900 ft. short of the runway causing extensive damage. The pilot was unable to get the aircraft airborne following the impact. Weather was below minima. Crew failed to monitor their instruments, became spatially disoriented and failed to arrest a high rate of descent. Pilot was inexperienced.",Low Fatality
388,12/21/1999,9:40,"GUATEMALA CITY, GUATEMALA",CUBANA DE AVIACON,261,HAVANA - GUATEMALA CITY,MCDONNELL DOUGLAS DC-10-30,F-GTDI,46890/77,314,16,2,298,0.949,"While attempting to land at La Aurora International Airport, the aircraft overshot the runway, rolled down an embankment and crashed into houses in the La Libertad section of the city. Witnesses say the plane was unable to stop after it began its landing too far down the runway. The crew failed to initiate a go-around after overshooting on a wet runway with insufficient deceleration to make a safe stop. Leased from AOM.",Low Fatality
389,12/24/1999,Not Available,"AMRITSAR, INDIA / KANDAHAR, AFGHANISTAN",INDIAN AIRLINES,814,KATHMANDU - NEW DELHI,AIRBUS A300B2-101,VT-EDW,36,189,1,0,188,0.995,"The plane was hijacked and subsequently flown to Amritsar, India, Lahore, Pakistan, al-Minhar Air Base, Dubai and Kandahar, Afghanistan. The hijacking lasted 7 days. One crewmember was killed.",Low Fatality
390,1/30/2000,21:08,"OFF ABIDJAN, IVORY COAST",KENYA AIRWAYS,431,ABIDJAN - LAGOS,AIRBUSA310-304,5Y-BEN,426,179,169,0,10,0.056,"The aircraft crashed into the AtlantiOcean three minutes after taking off from Felix Houphouet-Boigny Airport.  A few seconds after lifting off the ground the stall warning sounded and continued for about 20 seconds until it was manually turned off by the crew. Three seconds later the plane impacted the water. The pilot's response to an alarm that inaccurately indicated the plane had stalled. The pilot failed to complete established procedure for such an emergency. Takeoff conditions also contributed to the accident, which occurred at night, hampering the crew's ability to judge the plane's distance from the sea.",High Fatality
391,1/31/2000,16:21,"OFF POINT MUGU, CALIFORNIA",ALASKA AIRLINES,261,PUERTO VALLARTA - SAN FRANCISCO,MCDONNELL DOUGLAS MD-83,N963AS,53077/1995,88,88,0,0,0,"The aircraft crashed into the PacifiOcean south of Point Mugu in 650 ft. feet of water while en route from Puerto Vallarta to San Francisco. Radio transmissions from the plane indicated the pilots were struggling with a jammed stabilizer for the last 11 minutes of the flight before nose-diving into the sea. While preparing to make an emergency landing at Los Angeles International Airport control was lost and the MD-83 was seen in a nose-down attitude, spinning and tumbling in a continuous roll, inverted, before it impacted the sea.  Loss of airplane pitch control resulting from in-flight failure of the horizontal stabilizer trim system jackscrew assembly's acme nut thread. The component failed because of excessive wear resulting from Alaska Airlines' insufficient lubrication of the jackscrew assembly. Contributing to the accident were Alaska Airlines' extended lubrication interval and the Federal Aviation Administration's approval of that extension, which increased the likelihood that a missed or inadequate lubrication would result in excessive wear of the acme nut threads and Alaska Airlines' extended end play check interval and the FAA's approval of that extension, which allowed the excessive wear of the acme nut threads to progress to failure without the opportunity for detection. Also contributing to the accident was the absence on the McDonnell Douglas MD-80 of a fail-safe mechanism to prevent the catastrophieffects of total acme nut thread loss. Cynthia Oti, radio financial talk show host, Dean Forshee, guitarist, Jean Gandesberry, columnist, Tom Stockley, columnist were among those killed.",High Fatality
392,3/5/2000,18:11,"BURBANK, CALILFORNIA",SOUTHWEST AIRLINES,1455,LAS VEGAS - BURBANK,BOEING B-737-3T5,N668SW,23060/1069,142,0,0,142,1,"While attempting to land at Burbank Airport, the plane overran the runway, collided with a metal blast fence and an airport perimeter wall and came to rest on a city street near a gas station. The plane touched down at 182 knots, 2,150 feet past the runway threshold, too fast and too far down the runway for the plane to stop in time.  In the accident sequence,  the nose gear collapsed, the forward service door (1R) escape slide inflated inside the airplane and  the forward dual flight attendant jumpseat, which was occupied by two flight attendants, partially collapsed. Two passengers sustained serious injuries and 41 passengers and the captain sustained minor injuries. The flightcrew's excessive airspeed and flight path angle during the approach and landing and its failure to abort the approach when stabilized approach criteria were not met. Contributing to the accident was the controller's positioning of the airplane in such a manner as to leave no safe options for the flightcrew other than a go-around maneuver.",Low Fatality
393,4/19/2000,7:02,"SAMAL ISLAND, PHILIPPINES",AIR PHILIPPINES,541,MANILA - DAVAO,BOEING B-737-2H4,RP-C3010,21447/508,131,131,0,0,0,"The aircraft circled Davao airport in an attempt to land but crashed onto a coconut plantation on the mountainous Samal Island. The plane aborted a previous landing attempt because another plane was on the runway. Weather and visibility were good in the area but the landing attempt may have been hampered by low-lying clouds. The last message from the crew was that they were 7 miles from the airport on final approach. Nothing more was heard from the plane. The aircraft disintegrated upon impact near Mt. Kalangan. The elevation of the accident site was about 500 feet above sea level but the plane should have been at a altitude of 1,500 feet.",High Fatality
394,5/25/2000,Not Available,"NEAR MANILA, PHILIPPINES",PHILIPPINE AIR LINES,812,DAVAO - MANILA,AIRBUS A.330-301,F-OHZN,Not Available,298,1,0,297,0.997,"A hijacker robbed passengers, jumped out of the plane with a homemade parachute and was killed in the jump.",Low Fatality
395,7/25/2000,16:44,"GONESSE, FRANCE",AIR FRANCE,4590,PARIS - NEW YORK CITY,AEROSPATIALE BAE CONCORDE 101,F-BTSC,203,109,109,4,0,0,"The aircraft struggled to gain altitude after taking off from Charles de Gaulle airport. The pilot reported the No. 2 engine failed and struggled to steer towards Le Bourget airfield as smoke and fire trailed the jet's left wing.   The plane was unable to gain altitude, went nose high, stalled and crashed into a small hotel complex.  A metal strip left on the runway by another plane gashed one of the Concorde's tires which blew out sending a piece of rubber into the underside of the wing which sent a shockwave which ruptured a seam in the fuel tank. An electrical severed by another piece of rubber sparked which ignited leaking fuel ignited and started an uncontrollable fire. Power was lost to the No. 1 and No. 2 engines which led to loss of control of the aircraft and subsequent crash. Investigation revealed the metal strip was probably a thrust reverser part from Continental Airlines DC-10-30 , registered N13067 which departed Paris as Flight 055 to Newark. This is the first crash of a Concorde in aviation history.",High Fatality
396,8/23/2000,19:30,"OFF MANAMA, BAHRAIN",GULF AIR,72,CAIRO - MANAMA,AIRBUS A320-212,A4O-EK,481,143,143,0,0,0,"The aircraft crashed into the Persian Gulf and exploded in flames while attempting to land at Bahrain International Airport. The crew decided to perform a missed approach after it was determined the aircraft was coming in too high and fast. Instructions were given for a 180 degree turn and climb to 2,500 feet. While performing the missed approach the plane suddenly descended rapidly from an altitude of 1,000 feet and crashed into the shallow waters of the gulf approximately 1 mile from the airport. The accident was a result of a fatal combination of factors, including the captain's failure to comply with standard operating procedures and the copilot's actions in not drawing the captain's attention to the deviations of the aircraft from the standard flight parameters. The captain may have suffered a 'spatial disorientation' to ground warning systems, which could have made him falsely perceive the aircraft was pitching up. He responded by making a nose down input, resulting in the aircraft starting to descend, when aircraft warning systems were saying he should increase altitude.",High Fatality
397,10/25/2000,18:15,"NEAR BATUMI, REPUBLIOF GEORGIA",MILITARY - RUSSIAN AIR FORCE,Not Available,MOSCOW - BATUMI,ILYUSHIN IL-18D,RA-74295,187010602,86,86,0,0,0,"Communications were lost with the aircraft as it approached Mt. Tirina at 4,250 feet, preparing to land at Batumi. The aircraft was seen rapidly descending into mountainous terrain. A large explosion followed as the plane crashed somewhere between the towns of  Batumi and Kabuleti in heavy rain. Navigation error made by the crew in the final stage of the landing approach. Error by the Batumi ATC who failed to locate the plane and conform it to the crew. Erroneous data shown by ground radio-technical facilities at Batumi airport.",High Fatality
398,10/31/2000,23:17,"TAIPEI, TAIWAN",SINGAPORE AIRLINES,6,TAIPEI - LOS ANGELES,BOEING B-747-412,9V-SPK,28023/1099,179,83,0,96,0.536,"Weather conditions at the time were extremely poor due to typhoon Xiang Sane. A NOTAM issued on Aug 31, 2000 indicated that Runway 05R was closed due to construction between Sep 13 and Nov 22. After reaching the end of Taxiway NP, the plane turned onto Taxiway N1 and then made a 180-degree turn onto Runway 05R and began its takeoff roll. Approximately 3.5 seconds after reaching V1, the aircraft hit construction equipment on the runway, crashed back to the ground, broke up and burst into flames. The pilot attempted to take off from a closed runway. The following factors contributed to the accident. Of three lights used to guide the aircraft onto the correct runway, one was not working and another dim. The airport lacked 'guard lights' used to help pilots navigate from the taxiway to the correct runway during times of poor visibility. International regulations require that a large white X be placed on the tarmaat the entrance to a closed runway, but there was none at the entrance of runway 5R. Whether there should have been, in this case, however, is itself a contentious matter as the runway remained open for taxiing.",Low Fatality
399,11/20/2000,12:22,"MIAMI, FLORIDA",AMERICAN AIRLINES,Not Available,"MIAMI, FL - PORT AU PRINCE",AIRBUS A300-600R,N14056,463,114,1,0,113,0.991,"After climbing through 16,000 ft. the crew descovered cabin pressure could not be maintained and returned to the airport.  After landing the ram air switch failed to depressurize the aircraft. Moments later the left foreward door exploded open ejecting a flight attendant onto the tarmac.",Low Fatality
400,3/15/2001,Not Available,"MEDINA, SAUDI ARABIA",VNUKOVO AIRLINES,Not Available,"ISTANBUL, TURKY - MOSCOW, RUSSIA",TUPOLEV 154M,RA-85619,86A-738,174,3,0,171,0.983,"The plane was hijacked and flown to Medina, Saudi Arabia. The plane was stormed and three people killed.",Low Fatality
