ID,Date,Time,Location,Operator,Flight,Route,Type,Registration,CN_IN,Aboard,Fatalities,Ground,Survivors,SurvivalRate,Summary,ClustID
216,6/24/1982,20:44,"MOUNT GALUNGGUNG, INDONESIA",BRITISH AIRWAYS,9,KUALA LAMPUR - PERTH,BOEING B-747,G-BDXH,21635/365,257,0,0,257,1,"The aircraft flew into a plume from a volcanieruption at 37,000 feet during the night. All engines failed and the windshield lost transparency because of pitting. The first engine was restarted at 12,000 feet, followed by the other three and the plane landed safely at Jakarta. The aircraft was named 'City of Edinburgh.'",Low Fatality
217,6/28/1982,10:50,"SOUTHERN BELARUS, USSR",AEROFLOT,8641,LENINGRAD - KIEV,YAKOVLEV YAK-42,CCCP-45229,8040104,132,132,0,0,0,"From an altitude of 30,000 ft., a malfunction occurred causing the aircraft to crash 125 miles from its destination. In-flight failure and jamming of stabilizer screw-jack mechanism due to wear.",High Fatality
218,4/26/1982,16:45,"NEAR YANGSHUO, GUANGXI, CHINA",CAAC,3303,GUANGZHOU - GUILIN,HAWKER SIDDELEY TRIDENT 2E,B-266,2170,112,112,0,0,0,The aircraft struck a mountain in heavy rain during a landing attempt.,High Fatality
219,5/25/1982,Not Available,"BRAZILIA, BRAZIL",VASP,Not Available,NOT AVAILABLE,BOEING B-737-200,PP-SMY,20907,118,2,0,116,0.983,The aircraft broke in two after a hard landing. The pilot's misuse of rain repellant caused an optical illusion.,Low Fatality
220,6/8/1982,2:25,"NEAR PACATUBA, BRAZIL",VASP,168,RIO DE JANERIO - FORTALEZA,BOEING B-727-212A,PP-SRK,21347/1282,137,137,0,0,0,"The aircraft crashed into a 2,500 ft. mountain (Serra da Aratanha) during an approach in heavy rain and fog. Despite two altitude alert system warnings and the co-pilot's warning of the mountains ahead, the captain continued to descend below the minimum descend altitude. Non-observance of air traffiand carrier's procedures.",High Fatality
221,6/22/1982,Not Available,"BOMBAY, INDIA",AIR INDIA,Not Available,KUALA LUMPUR - MUMBAI,BOEING B-707-437,VT-DJJ,17723/100,111,17,0,94,0.847,The crew initiated a go-around after a heavy landing and a subsequently bounced lifted off the runway but descended back onto the ground and broke up. Deliberate reduction of engine power by the pilot 12 seconds prior to first impact due to altitude unawareness resulting in a high rate of descent and very hard landing. The aircraft was named 'Gaurishankar.',Low Fatality
222,7/6/1982,0:05,"NEAR MOSCOW, RUSSIA",AEROFLOT,411,NOT AVAILABLE,ILYUSHIN IL-62M,CCCP-86513,4037536,90,90,0,0,0,The aircraft crashed and burned in field shortly after takeoff. Failure of the aircraft's power plant fire warning system due to design deficiencies which resulted in false fire indications in both engines.,High Fatality
223,7/9/1982,16:09,"KENNER, LOUISIANA",PAN AMERICAN WORLD AIRWAYS,759,NEW ORLEANS - LAS VEGAS,BOEING B-727-235,N4737,19457/518,145,145,8,0,0,"The aircraft crashed during a thunderstorm, 29 seconds after taking off from New Orleans International Airport. The plane reached an altitude of 95 to 150 feet and then began to descend and crashed into trees and houses bursting into flames. Microbust induced windshear. Limited capability of current ground-based low-level windshear detection technology. The aircraft was named 'Clipper Defiance.'",High Fatality
224,9/13/1982,12:00,"NEAR MALAGA, SPAIN",SPANTAX,995,MALAGA - NEW YORK CITY,MCDONNELL DOUGLAS DC-10-30CF,EC-DEG,46962/238,394,50,0,344,0.873,The aircraft crashed during takeoff after intense vibration caused by a blown retreaded tire. The crew aborted the takeoff above VR and overran the runway. They also  failed to apply reverse thrust symmetrically.,Low Fatality
225,12/9/1982,c14:30,"NEAR SAN ANDRES DE BOCAY, NICARAGUA",MILITARY - NICARAGUAN AIR FORCE,Not Available,NOT AVAILABLE,MIL MI-8 (HELICOPTER),265,Not Available,88,84,0,4,0.045,Shot down by Sandinistan rebels.,High Fatality
226,4/29/1983,15:10,"GUAYAQUIL, ECUADOR",SAN ECUADOR,832,GUAYAQUIL - QUITO,SUD AVIATION SE-210 CARAVELLE VIR,HC-BAT,125,100,8,0,92,0.92,One of the aircraft's engines failed shortly after takeoff and the plane landed heavily on muddy ground and broke in three.,Low Fatality
227,5/5/1983,9:15,"EN ROUTE MIAMI, FL - NASSAU, BAHAMAS",EASTERN AIR LINES,855,"MIAMI, FL - NASSAU, BAHAMAS",LOCKHEED L-1011,N334EA,1141,172,0,0,172,1,"Procedural error by maintenance crew caused O-ring seal to be left off all three engines, causing all oil to leak out in flight. One engine shut down at first sign of trouble, followed by failure of other two engines. First engine restarted at an altitude of 3,000 feet and ran long enough to make a safe landing at Miami 9 minutes later.",Low Fatality
228,7/11/1983,7:40,"NEAR CUENCA, AZUAY, ECUADOR",TAME,Not Available,QUITO - CUENCA,BOEING B-737-2V2,HC-BIG,22607/775,119,119,0,0,0,"The jetliner scraped a mountian peak, exploded in flames and slid down a ravine coming to rest at the foot of a mountain. The plane was attempting to land in the Andean city of Cuenca. Under-qualification of pilot.",High Fatality
229,8/30/1983,23:17,"NEAR ALMA-ATA, KAZAKASTAN, USSR",AEROFLOT,Not Available,KAZAN - CHELYABINSK - ALMA-ATA,TUPOLEV TU-134A,CCCP-65129,60630,90,90,0,0,0,Crashed an burned after striking mountain  while attempting to land. Procedural errors.,High Fatality
230,9/1/1983,18:26,"NEAR SAKHALIN ISLAND, RUSSIA",KOREAN AIRLINES,7,ANCHORAGE - SEOUL,BOEING B-747-230B,HL-7442,20559/186,269,269,0,0,0,"On a flight from Alaska to South Korea, the airliner drifted off course and twice penetrated Soviet airspace.  During the second penetration, the airliner was shot down by a Russian Su-15 Air Force fighter with air-to-air missiles. The aircraft crashed into international waters in the Sea of Japan. U.S. Representative from Georgia Lawrence McDonald killed.",High Fatality
231,9/14/1983,9:34,"GUILIN, CHINA",CAAC,Not Available,GUILIN - BEIJING,HAWKER SIDDELEY TRIDENT 2E /  II-28,B-264 / ,2169 / ,106,11,0,95,0.896,Collided with a Chinese Air Force aircraft while taxing.,Low Fatality
232,9/23/1983,15:30,"NEAR MINA JEBEL ALI, UAE",GULF AIR,771,KARACHI - ABU DHABI,BOEING B-737-2P6,A40-BK,21734/566,112,112,0,0,0,Crashed  into the desert after a distress message and during an emergency landing attempt. Detonation of an explosive device in the baggage compartment.,High Fatality
233,11/8/1983,15:20,"LUBANGO, HUILA, ANGOLA",TAAG ANGOLA AIRLINES,Not Available,LUBANGO - LUANDA,BOEING B-737-200,D2-TBN,22775,130,130,0,0,0,The airliner crashed immediately after takeoff.  Shot down by rebels with a surface to air missile.,High Fatality
234,11/27/1983,10:06,"MADRID-BARAJAS, SPAIN",AVIANCA,11,PARIS - MADRID - BOGOTA,BOEING B-747-283B,HK-2910,21381,192,181,0,11,0.057,"While attempting to land at Madrid, the crew intercepted the wrong ILS track which caused the pilot to initiate a right turn short of the VOR beacon. The aircraft impacted a series of hills during which the right wing broke off, the aircraft cartwheeled and broke into 5 pieces and came to rest upside down. Procedural errors by the crew including the pilot not knowing his precise position before descending, failure of the crew to take corrective action after a warning from the  ground proximity warning system and deficient teamwork on the flight deck.  The aircraft was named 'Magnus Viking,' LN-RNA and dry-leased from SAS.",High Fatality
235,12/7/1983,9:40,"NEAR MADRID, SPAIN",IBERIA AIRLINES / AVIACO,350/134,MADRID - ROME,BOEING B-727-200 / DC9-32,EC-CFJ/EC-CGS,20820 / 47645,135,93,0,42,0.311,"While taking off, the B-727 struck the DC-9 on the runway in poor visibility, fog and snow. Because of poor visibility and inadequate signs and markings the, DC-9 inadvertently wandered on the runway being used by the B-727 to take off. The airport had no ground radar. Fifty-one aboard the 727 and all 42 aboard the DC-9 were killed. Mexican actress,  MarÃ­a 'Fanny Cano' DamiÃ¡n, 39, among those killed.",High Fatality
236,2/28/1984,16:16,"JFK AIRPORT, NEW YORK, NEW YORK",SCANDINAVIAN AIRLINES (SAS),901,"OSLO, NORWAY, NEW YORK, NY",MCDONNELL DOUGLAS DC-10-30,LN-RKB,46871,177,0,0,177,1,"While attempting to land at JFK, New York, the aircraft touched down 4,700 feet beyond the threshold, slid off end of runway and came to rest in a tidal waterway. The crew's disregard for prescribed procedures for monitoring and controlling of airspeed during the final stages of the approach and decision to continue the landing rather than to execute a missed approach. Overreliance on the autothrottle speed control system which had a history of recent malfunctions.",Low Fatality
237,8/30/1984,Not Available,"DOUALA, CAMEROON",CAMEROON AIRLINES,786,DOUALA - YAOUNDE,BOEING B-737-2H7C,TJ-CBD,21295/484,116,2,0,114,0.983,"When taxing tin preperation to takeoff, a compressor disin the No.2 engine failed. Debris punctured the wing and fuel tank causing an uncontrollable fire that destroyed the aircraft.",Low Fatality
238,10/11/1984,5:40,"NEAR OMSK, RUSSIA",AEROFLOT,3352,KRASNODAR - OMSK,TUPOLEV TU-154B,CCCP-85243,243,179,174,4,5,0.028,"While landing, the crew noticed something on the runway, took evasive action and crashed into two cleaning vehicles. The flying control officer (ATC)  fell asleep and did not inform the controllers cleaning vehicles were on the runway.",High Fatality
239,10/28/1984,Not Available,"NEAR KABUL, AFGHANISTAN",MILITARY - RUSSIAN AIR FORCE,Not Available,NOT AVAILABLE,ANTONOV AN-22,CCCP-08837,7340106,240,240,0,0,0,Shot down by Afghan rebels shortly after taking off. Worst single military aircraft disaster in history.,High Fatality
240,12/23/1984,18:10,"NEAR KRANOYARSK, RUSSIA",AEROFLOT,3519,NOT AVAILABLE,TUPOLEV TU-154B-2,CCCP-85338,338,110,110,0,0,0,The aircraft crashed while attempting an emergency landing after the No. 3 engine caught fire. Failure of a  compressor.,High Fatality
241,1/21/1985,1:04,"RENO, NEVADA",GALAXY AIRLINES,203,"RENO, NV - MINNEAPOLIS-ST. PAUL, MN",LOCKHEED L-188A ELECTRA,N5532,1121,71,70,0,1,0.014,"The aircraft crashed while returning to the airport after reporting severe vibrations. While attempting to land, the aircraft crashed into a  field, bounced and slid into mobile homes. A ground handler forgot to close an air start access door. The crew's failure to control and monitor the flight path and air speed of the aircraft after detecting the vibration.",High Fatality
242,2/1/1985,Not Available,"MINSK, BELARUS, USSR",AEROFLOT,Not Available,MINSK - LENINGRAD,TUPOLEV TU-134A,CCCP-65910,63971,80,58,0,22,0.275,The aircraft crashed shortly after taking off from Minsk. Icing. Double engine failure.,High Fatality
243,2/19/1985,9:27,"NEAR DURANGO, VIZCAYA, SPAIN",IBERIA AIRLINES,610,MADRID - BILBAO,BOEING B-727-256,EC-DDU,21777/1487,148,148,0,0,0,The aircraft crashed into an antenna on Mt. Oiz. Incorrect interpretation of Ground Proximity Warning System. The captain was heard shouting 'shut up' at the GPWS as it announced 'pull up.'  Overconfidence in altitude alert system. Incorrect interpretation of its warnings.,High Fatality
244,2/19/1985,10:15,"300 NM NW OF SAN FRANCISCO, CALIFORNIA",CHINA AIRLINES (TAIWAN),6,TAIPEI - LOS ANGELES,BOEING B-747-SP-09,N4522V,22805/564,274,0,0,274,1,"The aircraft descended in an uncontrolable dive, from 41,000 to 9,500 ft. after the crew shut down an engine.  The captain, preoccupied the malfunctioning engine, didn't properly monitor instruments and over relied on the autopilot and did not use his rudder to keep the plane from rolling . The autopilot disengaged after it could not handle the excessive roll caused by the shut down engine. The captain failed to make the proper flight corrections to recover the aircraft. After a terrifying series of inadvertent aerobatics, the plane leveled off at 9,500 feet and managed to land safely at San Francisco. Forces during the inverted spin were estimated to be from +6G to -4G. The landing gear was forced out through the closed doors, breaking the doors, which flew back and took out part of the rudder and elevator.",Low Fatality
245,5/3/1985,12:00,"NEAR L'VOV, UKRAINE, USSR",AEROFLOT / SOVIET AIR FORCE,Not Available,TALLIN - L'VOV,TUPOLEV TU-134A / ANTONOV AN-26,CCCP65856/26492,23253 /,76,76,0,0,0,Midair collision as the Tupolev-134A prepared to land and the Antonov An-26 just took off.  Violations by the civil approach and military controllers. Misidentification of both aircraft. Seventy-one killed on the TU134 and twenty-three on the Antonov.,High Fatality
246,6/14/1985,Not Available,"ATHENS, GREECE",TRANS WORLD AIRLINES,847,ATHENS - ROME,BOEING B-727-231,N64339,20844/1065,153,1,0,152,0.993,The aircraft was hijacked while en route from Athens to Rome over Italian airspace. U.S. Navy diver Robert Stethem was murdered aboard.,Low Fatality
247,6/23/1985,7:15,"ATLANTIOCEAN, 110 MILES WEST OF IRELAND",AIR INDIA,182,MONTREAL - LONDON,BOEING B-747-237B,VT-EFO,21473/330,329,329,0,0,0,"The aircraft broke up in flight and crashed into the ocean. Detonation of an explosive device in the forward cargo hold. Terrorist working in Vancouver, Canada, checked baggage with bombs onto two flights. One bag transferred at Toronto onto flight 182. The other would have been transferred at Tokyo onto another Air India flight, but exploded at the airport killing 2 baggage handlers. The aircraft was named 'Kanishka.'",High Fatality
248,7/10/1985,23:45,"NEAR UCHUDUK, UZBEKISTAN, USSR",AEROFLOT,7425,KARSHI - LENINGRAD,TUPOLEV TU-154B-2,CCCP-85311,311,200,200,0,0,0,The aircraft went into an uncontrolled descent from FL 400 and crashed.,High Fatality
249,7/24/1985,17:00,"LETICIA, COLOMBIA",FUERZA AÃ‰REA COLOMBIANA,Not Available,LETICIA - BOGOTA,DOUGLAS DC-6B,FAC-902,45067/709,80,80,0,0,0,"Crashed into the Amazon jungle in poor weather, after the crew reported a fire in the No. 3 engine. The last words from the aircraft was 'We're falling.'",High Fatality
250,8/2/1985,18:06,"FT. WORTH-DALLAS, TEXAS",DELTA AIR LINES,191,FORT LAUDERDALE - DALLAS-FORT WORTH,LOCKHEED L-1011-1 TRISTAR,N726DA,1163,163,134,1,29,0.178,"While on a flight from Fort Lauderdale, FL to Dallas/ Forth Worth, the aircraft crashed while making an landing attempt in thunderstorm activity. The plane touched down 6,000 feet short of the runway and 360 feet to the left of the runway centerline, became airborne again, struck a car killing the driver, crossed the highway and crashed into two water tank reservoirs. Microburst induced windshear. The flightcrew's decision to initiate and continue the approach into a cumulonimbus cloud which they observed to contain lightning. Lack of training for avoiding and escaping from low-altitude windshear.",High Fatality
251,8/12/1985,18:56,"MT. OSUTAKA, NEAR UENO VILLAGE, JAPAN",JAPAN AIR LINES,123,TOKYO - OSAKA,BOEING B-747-SR46,JA8119,20783/230,524,520,0,4,0.008,"The aircraft suffered an aft pressure bulkhead failure at 23,900 ft. The aircraft had severe control difficulties with loss of all controls and eventually after 40 minutes, collided with a mountain. Improper repair of the  bulkhead while being supervised by Boeing engineers after a tail strike in 1978. Worst single plane disaster in aviation history. Kyu Sakamoto, 43, famous for his Japanese song 'Sukiyaki' was killed in the accident.",High Fatality
252,8/22/1985,6:13,"MANCHESTER, ENGLAND",BRITISH AIRTOURS,28M,MANCHESTER - KERKIRA,BOEING B-737-236,G-BGJL,22033/743,137,55,0,82,0.599,"During takeoff from Manchester, failure of the No. 9 combustor on the port engine resulted in its ejection from the engine and fracturing of the fuel tank access panel and resulting fire. The fire spread into the cabin incapacitating and killing passengers due to toxismoke. Thermal metal fatigue of the combustor. Slow braking, using reverse thrust and turning the aircraft to starboard, sideways to a prevailing wind, all helped to feed the flames. The aircraft was named 'River Orrin.'",High Fatality
253,11/24/1985,20:15,"LUQA, MALTA",EGYPTAIR,648,ATHENS - CAIRO,BOEING B-737-266,SU-AYH,21191/450,103,60,0,43,0.417,"Hijacking. While on the ground at Malta to refuel the aircraft was stormed by Egyptian forces. During the fight, several hand grenades were thrown into the cabin causing a fire.",High Fatality
254,12/12/1985,6:45,"GANDER, NEWFOUNDLAND, CANADA",ARROW AIRWAYS,MF1285R,"GANDER - FORT CAMPBELL, KY",MCDONNELL DOUGLAS DC-8 SUPER 63PF,N950JW,46058/433,256,256,0,0,0,"The aircraft stalled and crashed during takeoff. Two-hundred-forty-four members of the 101st Airborne Division from Fort Campbell, Kentucky  were killed in the accident. There is controversy surrounding this crash. The majority opinion of the board was that the cause of the sequence leading up to the stall and crash could not be determined, with icing a possibility. The minority opinion was that the crash was possibly caused by detonation of an explosive device of unknown origin in a cargo compartment which led to an in-flight fire and loss of control of the aircraft.",High Fatality
255,1/18/1986,8:00,"NEAR PETEN, GUATEMALA",AEROVIAS DE GUATEMALA SA,Not Available,GUATEMALA CITY - FLORES,SUD-AVIATION  CARAVELLE VI-N,HC-BAE,40,87,87,0,0,0,"After initiating an overshoot and attempting to land for a second time, the plane crashed into a hilly area in the jungle. There were low lying clouds in the area.",High Fatality
256,3/31/1986,9:11,"MARAVATIO, MEXICO",MEXICANA,940,MEXICO CITY - PUERTO VALLARTA,BOEING B-727-264,XA-MEM,22414/1748,167,167,0,0,0,"While climbing through 29,000 feet, an overheated tire exploded in the wheel well after takeoff and damaged the hydrauliand electrical systems of the aircraft. The plane lost control and crashed. The tire had been serviced with air rather than nitrogen. The air, under high temperature and pressure, resulted in a chemical reaction within the tire itself which led to a explosion of the tire.",High Fatality
257,4/2/1986,Not Available,"NEAR ATHENS, GREECE",TRANS WORLD AIRLINES,840,ROME - ATHENS,BOEING B-727,N54340,20845/1066,121,4,0,117,0.967,Detonation of a explosive device in the passenger compartment causing four passengers to be sucked out.  The plane landed safely at Athens. The plastiexplosive was left under a seat by a woman carrying a Lebanese passport.,Low Fatality
258,5/3/1986,Not Available,"COLOMBO, SRI LANKA",AIR LANKA,Not Available,"COLOMBO - MALE, MALDIVES",LOCKHEED L-1011-100,4R-ULD,1061,150,22,0,128,0.853,Detonation of an explosive device in the rear section of the cabin while on the ground and passengers were boarding. The aircraft was named City of Colombo.,Low Fatality
259,7/2/1986,10:27,"NEAR SYKTYVAR, RUSSIA",AEROFLOT,Not Available,NOT AVAILABLE,TUPOLEV TU-134A,CCCP-65120,60482,94,54,0,40,0.426,The aircraft crashed in a forest after an in-flight fire caused by baggage that ignited in the rear cargo hold led to loss of contol of the aircraft.,High Fatality
260,9/5/1986,6:00,"KARACHI, PAKISTAN",PAN AMERICAN WORLD AIRWAYS,73,BOMBAY-KARACHI-FRANKFURT-NEW YORK,BOEING B-747-121,N656PA,20351/127,384,16,1,368,0.958,"While on the ground, four hijackers opened fire on the passengers and crew and threw grenades among them, killing 16 passengers, one crew member and one ground crew memeber. The aircraft was named Clipper Empress of the Seas.",Low Fatality
261,10/20/1986,15:50,"KUYBYSHEV, RUSSIA",AEROFLOT,Not Available,YEKATERINBURG - KUYBYSHEV,TUPOLEV TU-134A,CCCP-65766,62327,92,70,0,22,0.239,The plane crashed and burst into flames after a straight-in hard landing without leveling off.,High Fatality
262,11/2/1986,19:25,"NEAR ZAHEDAN, IRAN",MILITARY - IRANIAN AIR FORCE,Not Available,BAKHTARAN - ZAHEDAN,LOCKHEED C-130,Not Available,Not Available,103,103,0,0,0,Struck the side of a mountain near the Pakistani border. Crew error. Descent below minimum safe altitude with a defective altimeter and in spite of warnings from the ATC.,High Fatality
263,12/12/1986,Not Available,"BERLIN, EAST GERMANY",AEROFLOT,Not Available,MINSK - BERLIN,TUPOLEV TU-134A,CCCP-65795,63145,82,70,0,12,0.146,The aircraft crashed after landing on the wrong runway in fog. The crew did not understand the English instructions that the right runway was closed for repairs.,High Fatality
264,12/25/1986,Not Available,"AY, SAUDI ARABIA",IRAQI AIRWAYS,Not Available,BAGHDAD - AMMAN,BOEING B-737-270C,YI-AGJ,21183,106,63,0,43,0.406,"Hijacking.  While on a flight from Baghdad to Amman, hijackers exploded a hand grenade in the passenger cabin. While making an emergency descent a second hand grenade exploded in the cockpit causing the plane to lose control crash, break in two and catch fire.",High Fatality
265,5/9/1987,11:12,"WARSAW, POLAND",LOT POLISH AIRLINES,5055,WARSAW - NEW YORK CITY,ILYUSHIN IL-62M,SP-LBG,3344942,183,183,0,0,0,"The No. 2 engine failed, causing an engine fire, cabin decompression, damage to the  No. 1 engine, loss of  elevator control and damage to the electrical system. A fire in the cargo hold was not detected because of damage to the fire warning system. While attempting to return to Warsaw and attempting a turn to land, the aircraft crashed into a forest, 9 miles short of the runway. The cause of the engine failure was an overheated bearing. The aircraft was named Tadeusz Kosciuszko.",High Fatality
266,7/24/1987,Not Available,"GENEVA, SWITZERLAND",AIR AFRIQUE,56,BRAZZAVILLE - PARIS,MCDONNELL DOUGLAS DC-10-30,Not Available,Not Available,163,1,0,162,0.994,"Hijacked while en route from Rome, Italy to Paris, France. The hijacker killed one male passenger when the plane landed at Cointrin Airport in Switzerland to refuel, after which the plane was stormed by security personnel.",Low Fatality
267,1/18/1988,22:17,"NEAR CHUNGKING, SICHUAN, CHINA",CHINA SOUTHWEST AIRLINES,4146,BEIJING - CHONGQING,ILYUSHIN IL-18D,B-222,187009901,108,108,0,0,0,The aircraft crashed 10 minutes before its scheduled landing. Fire in and failure of the No. 4 engine led to separation of the pylon and engine and loss of control of the aircraft. Overheating of the feathering oil. Poor maintenance procedures.,High Fatality
268,8/16/1987,20:46,"ROMULUS, MICHIGAN",NORTHWEST AIRLINES,255,"DETROIT, MI - PHOENIX, AZ",MCDONNELL DOUGLAS MD-82,N312RC,48090/1040,155,154,2,1,0.006,"The aircraft stalled and crashed during takeoff from Detroit Metropolitan Wayne County Airport. After liftoff, the wings of the airplane rolled to the left and right  and then the aircraft collided with obsticales northeast of the runway when the left wing struck light poles and the roof of a rental car agency. A 4-year-old girl, Cecilia Cichan, was the only survivor. Slats and flaps not extended. Crew's failure to use taxi checklist to ensure flaps and slats were extended. Lack of electrical power to the aircraft takeoff warning system. Cecelia is now married and earned a Psychology degree from the University of Alabama. Although she has made no publistatements or attended annual memorial services regarding the tragicrash, she corresponds with some of the crash victimsâ€™ loved ones.",High Fatality
269,8/31/1987,15:36,"OFF KO PHUKET, THILAND",THAI AIRWAYS,365,HAT YAI - PHUKET,BOEING B-737-2P5,HS-TBC,22267/685,83,83,0,0,0,The aircraft stalled and crashed into the ocean after the crew's attention was diverted to concern over another aircraft. Failure of the crew to monitor their airspeed. The pilot added power and raised the gear after the stick shaker activated but did not execute a recovery before hitting the sea.,High Fatality
270,11/28/1987,4:00,"OFF MAURITIUS, INDIAN OCEAN",SOUTH AFRICAN AIRWAYS,295,"TAIPEI, TAIWAN -  MAURITIUS - JOHANNESBURG, SOUTH AFRICA",BOEING B-747-244B,ZS-SAS,22171/488,159,159,0,0,0,"While over the Indian Ocean the crew contacted Mauritius approach control and reporting fire and smoke aboard. Three minutes after the last transmission the plane the plunged into the ocean 150 miles northeast of Mauritius. The fire caused incapacitation and disorientation of the crew, in-flight break-up and loss of control of the aircraft.  The fire originated in a front pallet on the right side in the upper deck cargo hold. The fire of unknown origin possibly (1) incapacitated the crew; (2) caused disorientation of the crew due to thick smoke; (3) caused crew distraction; (4) weakened the aircraft structure, causing an in-flight break-up; (5) burned through control cables or ; (6) caused loss of control due to deformation of the aircraft fuselage.",High Fatality
271,11/29/1987,11:30,OVER THE ANDAMAN SEA,KOREAN AIRLINES,858,ABU DHABI - BANGKOK,BOEING B-707-3B5C,HL-7406,20522/855,115,115,0,0,0,"The plane crashed while on a flight from Abu Dhabi to Bangkok. Detonation of an explosive device in the passenger cabin left by two passengers who exited  the plane at Abu Dhabi. A 75 year old man and Korean woman were arrested as they tried to use fake passports to fly to Rome. While under guard, the man bit into a cyanide capsule and died. The woman, a North Korean agent, confessed to the crime.",High Fatality
272,1/18/1988,4:20,"KROSNOVODSK, USSR",AEROFLOT,Not Available,MOSCOW - KROSNOVODSK,TUPOLEV TU 154B-2,CCCP-85254,77A254,143,11,0,132,0.923,Broke in two after a heavy landing. Crew error. Co-pilot was flying the plane against requirements that the pilot fly the plane.,Low Fatality
273,3/17/1988,13:17,"NEAR CUCUTA, N OF  SANTANDER, COLOMBIA",AVIANCA,410,CUCUTA - CARTAGENA,BOEING B-727-21,HK-1716,18999/240,143,143,0,0,0,"The aircraft struck a mountain at 6,200 feet after taking off in mist and haze. The crew took off under VFR conditions during adverse weather conditions. Inappropriate presence of a non-crew pilot in the cockpit and his great talkativeness distracting part of the crew which resulted in carelessness and disorientation in monitoring the heading and altitude necessary to maneuver the plane. VFR flight into IFR conditions.",High Fatality
274,4/5/1988,Not Available,"COMBI, CYPRUS",KUWAIT AIRWAYS,Not Available,BANGKOK - KUWAIT,BOEING B-747-200,9K-ADA,21541,112,2,0,110,0.982,Hijacking. Two hostages killed on the ground.,Low Fatality
